[
  {
    "id": "golden-ms-001",
    "language": "ms",
    "question": "Bagaimana menggunakan laman ini?",
    "context": { "currentPage": "/about", "language": "ms" },
    "implementationStatus": "IMPLEMENTED",
    "expected": { "intent": "SITE_KNOWLEDGE", "operations": { "comparison": false, "ranking": false, "trend": false, "weakest": false, "strongest": false, "targetGap": false, "sdgProgress": false, "districtLevel": false, "latest": false }, "blocked": false, "clarificationRequired": false, "knowledge": { "status": "FOUND", "expectedRecordIds": ["about-borneo-tracker-ms"], "sourceCountMin": 1 } },
    "tags": ["site_knowledge"]
  },
  {
    "id": "golden-ms-002",
    "language": "ms",
    "question": "Apakah fungsi halaman ESG?",
    "context": { "currentPage": "/esg", "language": "ms" },
    "implementationStatus": "IMPLEMENTED",
    "expected": { "intent": "SITE_KNOWLEDGE", "operations": { "comparison": false, "ranking": false, "trend": false, "weakest": false, "strongest": false, "targetGap": false, "sdgProgress": false, "districtLevel": false, "latest": false }, "blocked": false, "clarificationRequired": false, "knowledge": { "status": "FOUND", "expectedRecordIds": ["esg-indicators-page-ms"], "sourceCountMin": 1 } },
    "tags": ["site_knowledge"]
  },
  {
    "id": "golden-ms-003",
    "language": "ms",
    "question": "Bagaimana jana laporan?",
    "context": { "currentPage": "/reports", "language": "ms" },
    "implementationStatus": "IMPLEMENTED",
    "expected": { "intent": "SITE_KNOWLEDGE", "operations": { "comparison": false, "ranking": false, "trend": false, "weakest": false, "strongest": false, "targetGap": false, "sdgProgress": false, "districtLevel": false, "latest": false }, "blocked": false, "clarificationRequired": false, "knowledge": { "status": "FOUND", "expectedRecordIds": ["generate-report-page-ms"], "sourceCountMin": 1 } },
    "tags": ["site_knowledge"]
  },
  {
    "id": "golden-ms-004",
    "language": "ms",
    "question": "Apakah skor daya tahan Sabah?",
    "context": { "currentPage": "/dashboard", "region": "Sabah", "language": "ms" },
    "implementationStatus": "IMPLEMENTED",
    "expected": { "intent": "DASHBOARD_DATA", "territories": ["Sabah"], "concepts": ["resilience"], "operations": { "comparison": false, "ranking": false, "trend": false, "weakest": false, "strongest": false, "targetGap": false, "sdgProgress": false, "districtLevel": false, "latest": false }, "comparabilityDecision": "ALLOW", "factAvailability": "AVAILABLE", "blocked": false, "clarificationRequired": false, "fallbackReason": "GEMINI_MALFORMED_RESPONSE" },
    "tags": ["dashboard", "fallback"]
  },
  {
    "id": "golden-ms-005",
    "language": "ms",
    "question": "Tunjukkan skor tunjang Tenaga Sarawak.",
    "implementationStatus": "IMPLEMENTED",
    "expected": { "intent": "DASHBOARD_DATA", "territories": ["Sarawak"], "pillars": ["Energy"], "operations": { "comparison": false, "ranking": false, "trend": false, "weakest": false, "strongest": false, "targetGap": false, "sdgProgress": false, "districtLevel": false, "latest": false }, "comparabilityDecision": "ALLOW", "factAvailability": "AVAILABLE", "blocked": false, "clarificationRequired": false },
    "tags": ["dashboard"]
  },
  {
    "id": "golden-ms-006",
    "language": "ms",
    "question": "Apakah penunjuk elektrik Brunei?",
    "implementationStatus": "IMPLEMENTED",
    "expected": { "intent": "DASHBOARD_DATA", "territories": ["Brunei Darussalam"], "concepts": ["energy"], "operations": { "comparison": false, "ranking": false, "trend": false, "weakest": false, "strongest": false, "targetGap": false, "sdgProgress": false, "districtLevel": false, "latest": false }, "comparabilityDecision": "ALLOW", "factAvailability": "AVAILABLE", "blocked": false, "clarificationRequired": false },
    "tags": ["dashboard"]
  },
  {
    "id": "golden-ms-007",
    "language": "ms",
    "question": "Tunjang manakah paling lemah di Sabah?",
    "implementationStatus": "IMPLEMENTED",
    "expected": { "intent": "DASHBOARD_DATA", "territories": ["Sabah"], "operations": { "comparison": false, "ranking": false, "trend": false, "weakest": true, "strongest": false, "targetGap": false, "sdgProgress": false, "districtLevel": false, "latest": false }, "comparabilityDecision": "ALLOW", "factAvailability": "AVAILABLE", "blocked": false, "clarificationRequired": false },
    "tags": ["dashboard"]
  },
  {
    "id": "golden-ms-008",
    "language": "ms",
    "question": "Tunjang manakah paling kuat di Kalimantan?",
    "implementationStatus": "IMPLEMENTED",
    "expected": { "intent": "DASHBOARD_DATA", "territories": ["Kalimantan"], "operations": { "comparison": false, "ranking": false, "trend": false, "weakest": false, "strongest": true, "targetGap": false, "sdgProgress": false, "districtLevel": false, "latest": false }, "comparabilityDecision": "ALLOW", "factAvailability": "AVAILABLE", "blocked": false, "clarificationRequired": false },
    "tags": ["dashboard"]
  },
  {
    "id": "golden-ms-009",
    "language": "ms",
    "question": "Apakah jurang sasaran data papan pemuka akses air bersih Sabah?",
    "implementationStatus": "IMPLEMENTED",
    "expected": { "intent": "DASHBOARD_DATA", "territories": ["Sabah"], "concepts": ["clean_water_access"], "operations": { "comparison": false, "ranking": false, "trend": false, "weakest": false, "strongest": false, "targetGap": true, "sdgProgress": false, "districtLevel": false, "latest": false }, "comparabilityDecision": "ALLOW", "factAvailability": "AVAILABLE", "blocked": false, "clarificationRequired": false, "fallbackReason": "GEMINI_EMPTY_RESPONSE" },
    "tags": ["dashboard", "fallback"]
  },
  {
    "id": "golden-ms-010",
    "language": "ms",
    "question": "Apakah jurang sasaran data papan pemuka warisan Sabah?",
    "implementationStatus": "PARTIALLY_IMPLEMENTED",
    "expected": { "intent": "DASHBOARD_DATA", "territories": ["Sabah"], "concepts": ["heritage"], "operations": { "comparison": false, "ranking": false, "trend": false, "weakest": false, "strongest": false, "targetGap": true, "sdgProgress": false, "districtLevel": false, "latest": false }, "comparabilityDecision": "ALLOW", "factAvailability": "PARTIAL", "blocked": false, "clarificationRequired": false },
    "tags": ["dashboard"]
  },
  {
    "id": "golden-ms-011",
    "language": "ms",
    "question": "Bandingkan litupan hutan Brunei berbanding Sabah.",
    "implementationStatus": "IMPLEMENTED",
    "expected": { "intent": "DASHBOARD_DATA", "territories": ["Brunei Darussalam", "Sabah"], "concepts": ["forest_cover"], "operations": { "comparison": true, "ranking": false, "trend": false, "weakest": false, "strongest": false, "targetGap": false, "sdgProgress": false, "districtLevel": false, "latest": false }, "comparabilityDecision": "REJECT", "factAvailability": "BLOCKED", "blocked": true, "clarificationRequired": false },
    "tags": ["comparison", "safety"]
  },
  {
    "id": "golden-ms-012",
    "language": "ms",
    "question": "Bandingkan ekonomi Sabah dan Brunei.",
    "implementationStatus": "IMPLEMENTED",
    "expected": { "intent": "DASHBOARD_DATA", "territories": ["Sabah", "Brunei Darussalam"], "concepts": ["economy"], "operations": { "comparison": true, "ranking": false, "trend": false, "weakest": false, "strongest": false, "targetGap": false, "sdgProgress": false, "districtLevel": false, "latest": false }, "comparabilityDecision": "REJECT", "factAvailability": "BLOCKED", "blocked": true, "clarificationRequired": false },
    "tags": ["comparison", "safety"]
  },
  {
    "id": "golden-ms-013",
    "language": "ms",
    "question": "Bandingkan tadbir urus Sabah dan Sarawak.",
    "implementationStatus": "IMPLEMENTED",
    "expected": { "intent": "DASHBOARD_DATA", "territories": ["Sabah", "Sarawak"], "concepts": ["governance"], "operations": { "comparison": true, "ranking": false, "trend": false, "weakest": false, "strongest": false, "targetGap": false, "sdgProgress": false, "districtLevel": false, "latest": false }, "comparabilityDecision": "REJECT", "factAvailability": "BLOCKED", "blocked": true, "clarificationRequired": false },
    "tags": ["comparison", "safety"]
  },
  {
    "id": "golden-ms-014",
    "language": "ms",
    "question": "Bandingkan penggunaan internet Sabah dan Kalimantan.",
    "implementationStatus": "PARTIALLY_IMPLEMENTED",
    "expected": { "intent": "DASHBOARD_DATA", "territories": ["Sabah", "Kalimantan"], "concepts": ["internet_use"], "operations": { "comparison": true, "ranking": false, "trend": false, "weakest": false, "strongest": false, "targetGap": false, "sdgProgress": false, "districtLevel": false, "latest": false }, "comparabilityDecision": "ALLOW", "factAvailability": "AVAILABLE", "blocked": false, "clarificationRequired": false },
    "tags": ["comparison"]
  },
  {
    "id": "golden-ms-015",
    "language": "ms",
    "question": "Bandingkan titik panas kebakaran Sabah dan Kalimantan.",
    "implementationStatus": "PARTIALLY_IMPLEMENTED",
    "expected": { "intent": "DASHBOARD_DATA", "territories": ["Sabah", "Kalimantan"], "concepts": ["fire_hotspots"], "operations": { "comparison": true, "ranking": false, "trend": false, "weakest": false, "strongest": false, "targetGap": false, "sdgProgress": false, "districtLevel": false, "latest": false }, "comparabilityDecision": "DOWNGRADE", "factAvailability": "PARTIAL", "blocked": false, "clarificationRequired": false },
    "tags": ["comparison"]
  },
  {
    "id": "golden-ms-016",
    "language": "ms",
    "question": "Bandingkan taman negara Sabah dan Sarawak.",
    "implementationStatus": "PARTIALLY_IMPLEMENTED",